objectid,title,filename,format,creator,date,datecreated,description,subject,location,latitude,longitude,source,type,rights,creativecommons,rightsnotes,citation,archivedpage
staggs_image_railroadlogsverso_002,Postcard - Verso: Railroad car with logs,staggs_image_railroadlogsverso_002.jpg,image/jpeg,Gerald W. Williams,1908,1908,"This is the backside of a postcard. The writing describes the location of the image on the front of the postcard, where that is in relation to the writer's location, and the types of logs in the image.",Postcard; Logging,Portland (inhabited place),45.515232,-122.6783853,"<a href=""https://oregondigital.org/concern/images/df66tx285"" target=""_blank"">Gerald W. Williams Collection - Oregon Digital</a>",Image; Still Image,"<a href=""https://rightsstatements.org/page/NoC-US/1.0/"" target=""_blank"">No Copyright - United States</a>","<a href=""https://creativecommons.org/publicdomain/mark/1.0/"" target=""_blank"">Public Domain Mark 1.0</a>",,"""Postcard - Verso: Railroad car with logs"" Gerald W. Williams. 1908, Oregon State University Libraries and Press, Oregon. Oregon Digital, Gerald W. Williams Collection, <a href='https://oregondigital.org/concern/images/df66tx285' target='_blank'>https://oregondigital.org/concern/images/df66tx285</a>","<a href=""https://web.archive.org/web/20230521231558/https://oregondigital.org/concern/images/df66tx285"" target=""_blank"">Archived Page</a>"
staggs_image_sprucelogjack,A spruce log on a log jack,staggs_image_sprucelogjack.jpg,image/jpeg,Corydon P. Cronk,1911,1910/1911,"In this image, a spruce log is resting on a log jack. The sawmill where the photograph was taken is Smith Mill, located in what was once Marshfield, OR - known today as Coos Bay, OR.",Forests and forestry—Equipment and supplies; Conifers; Logging,Coos Bay (inhabited place),43.3672213,-124.2131325,"<a href=""https://oregondigital.org/concern/images/df67q7840"" target=""_blank"">The Siuslaw National Forest Collection - Oregon Digital</a>",Image; Still Image,"<a href=""https://rightsstatements.org/page/NoC-US/1.0/"" target=""_blank"">No Copyright - United States</a>","<a href=""https://creativecommons.org/publicdomain/mark/1.0/"" target=""_blank"">Public Domain Mark 1.0</a>",,"""A spruce log on a log jacks,"" Corydon P. Cronk. 1910/1911, Oregon State University Libraries and Press, Oregon. Oregon Digital, The Siuslaw National Forest Collection, <a href='https://oregondigital.org/concern/images/df67q7840' target='_blank'>https://oregondigital.org/concern/images/df67q7840</a>","<a href=""https://web.archive.org/web/20230521231727/https://oregondigital.org/concern/images/df67q7840"" target=""_blank"">Archived Page</a>"
staggs_image_donkeyengine,Men surrounding a donkey engine,staggs_image_donkeyengine.jpg,image/jpeg,Gerald W. Williams,1915,1915,"The image shows several loggers standing around a donkey engine - a piece of equipment used to lift, drag, move, and load logs. In the background there are several trees that seem to have been cut down and several pieces of chopped wood. There are also two donkeys standing on the side of the men.",Forests and forestry—Equipment and supplies; Logging; Animals in logging; Workers,Multnomah (county),45.5145659,-122.5863211,"<a href=""https://oregondigital.org/concern/images/df66vb91k"" target=""_blank"">Gerald W. Williams Collection - Oregon Digital</a>",Image; Still Image,"<a href=""https://rightsstatements.org/page/NoC-US/1.0/"" target=""_blank"">No Copyright - United States</a>","<a href=""https://creativecommons.org/publicdomain/mark/1.0/"" target=""_blank"">Public Domain Mark 1.0</a>",,"""Men surrounding a donkey engine,"" Gerald W. Williams. 1915, Oregon State University Libraries and Press, Oregon. Oregon Digital, Gerald W. Williams Collection, <a href='https://oregondigital.org/concern/images/df66vb91k' target='_blank'>https://oregondigital.org/concern/images/df66vb91k</a>","<a href=""https://web.archive.org/web/20230521231900/https://oregondigital.org/concern/images/df66vb91k"" target=""_blank"">Archived Page</a>"
lucero_image_beavercreekschool,"Beaver Creek School, community workday",lucero_image_beavercreekschool.jpg,image/jpeg,Rogue River-Siskiyou National Forest Agency,1925,1925,A group of students posing for a picture during their community volunteer work day in which they worked in forest environmental protection.,Forestry schools and education,Beaver Creek (inhabited place),45.28460988,-122.5171674,"<a href=""https://cdm16085.contentdm.oclc.org/digital/collection/p15013coll4/id/112"" target=""_blank"">Rogue River National Forest Historic Images - Southern Oregon Digital Archives</a>",Image; Still Image,"<a href=""https://rightsstatements.org/page/NoC-US/1.0/"" target=""_blank"">No Copyright - United States</a>","<a href=""https://creativecommons.org/publicdomain/mark/1.0/"" target=""_blank"">Public Domain Mark 1.0</a>","Please provide the following credit required by the Memorandum of Understanding between Hannon Library and the Rogue River-Siskiyou National Forest: “This photograph is part of the Historical Records Collection of the Rogue River National Forest, and made available courtesy of Southern Oregon University Hannon Library.” See also: <a href=""http://soda.sou.edu/copyright.html""target=""_blank"">http://soda.sou.edu/copyright.html</a>","""Beaver Creek School, community workday,"" Rogue River-Siskiyou National Forest Agency. 1925, Southern Oregon University, Oregon. Southern Oregon Digital Archives, Rogue River National Forest Historic Images, <a href='https://cdm16085.contentdm.oclc.org/digital/collection/p15013coll4/id/112' target='_blank'>https://cdm16085.contentdm.oclc.org/digital/collection/p15013coll4/id/112</a>","<a href=""https://web.archive.org/web/20230522202500/https://cdm16085.contentdm.oclc.org/digital/collection/p15013coll4/id/112"" target=""_blank"">Archived Page</a>"
lucero_image_loggerstape,Logger's tape,lucero_image_loggerstape.jpg,image/jpeg,Rogue River-Siskiyou National Forest Agency,1972,1972,A roll of logger's tape engraved with the words 'Spencer Loggers Tape' on a blank black background.,Forests and forestry—Equipment and supplies,,,,"<a href=""https://cdm16085.contentdm.oclc.org/digital/collection/p15013coll4/id/473"" target=""_blank"">Rogue River National Forest Historic Images - Southern Oregon Digital Archives</a>",Image; Still Image,"<a href=""https://rightsstatements.org/page/NoC-US/1.0/"" target=""_blank"">No Copyright - United States</a>","<a href=""https://creativecommons.org/publicdomain/mark/1.0/"" target=""_blank"">Public Domain Mark 1.0</a>","Please provide the following credit required by the Memorandum of Understanding between Hannon Library and the Rogue River-Siskiyou National Forest: “This photograph is part of the Historical Records Collection of the Rogue River National Forest, and made available courtesy of Southern Oregon University Hannon Library.” See also: <a href=""http://soda.sou.edu/copyright.html""target=""_blank"">http://soda.sou.edu/copyright.html</a>","""Logger's Tape,"" Rogue River-Siskiyou National Forest Agency. 1972, Southern Oregon University, Oregon. Southern Oregon Digital Archives, Rogue River National Forest Historic Images, <a href='https://cdm16085.contentdm.oclc.org/digital/collection/p15013coll4/id/473' target='_blank'>https://cdm16085.contentdm.oclc.org/digital/collection/p15013coll4/id/473</a>","<a href=""https://web.archive.org/web/20230522202927/https://cdm16085.contentdm.oclc.org/digital/collection/p15013coll4/id/473"" target=""_blank"">Archived Page</a>"
lucero_image_oldgrowthfir,Old-growth fir stand being viewed by unidentified man,lucero_image_oldgrowthfir.jpg,image/jpeg,Rogue River-Siskiyou National Forest Agency,1945,1945,A man inspects an old-growth fir stand in a forest with his car behind him.,Conifers; Workers; Foresters,Rogue River National Forest (forest),42.06236385,-123.9387952,"<a href=""https://cdm16085.contentdm.oclc.org/digital/collection/p15013coll4/id/468"" target=""_blank"">Rogue River National Forest Historic Images - Southern Oregon Digital Archives</a>",Image; Still Image,"<a href=""https://rightsstatements.org/page/NoC-US/1.0/"" target=""_blank"">No Copyright - United States</a>","<a href=""https://creativecommons.org/publicdomain/mark/1.0/"" target=""_blank"">Public Domain Mark 1.0</a>","Please provide the following credit required by the Memorandum of Understanding between Hannon Library and the Rogue River-Siskiyou National Forest: “This photograph is part of the Historical Records Collection of the Rogue River National Forest, and made available courtesy of Southern Oregon University Hannon Library.” See also: <a href=""http://soda.sou.edu/copyright.html""target=""_blank"">http://soda.sou.edu/copyright.html</a>","""Old-growth fir stand being viewed by unidentified man,"" Rogue River-Siskiyou National Forest Agency. 1945, Southern Oregon University, Oregon. Southern Oregon Digital Archives, Rogue River National Forest Historic Images, <a href='https://cdm16085.contentdm.oclc.org/digital/collection/p15013coll4/id/468' target='_blank'>https://cdm16085.contentdm.oclc.org/digital/collection/p15013coll4/id/468</a>","<a href=""https://web.archive.org/web/20230522205035/https://cdm16085.contentdm.oclc.org/digital/collection/p15013coll4/id/468"" target=""_blank"">Archived Page</a>"
lucero_image_pilingandburning,Piling and burning slash,lucero_image_pilingandburning.jpg,image/jpeg,Rogue River-Siskiyou National Forest Agency,1930,1930,Two workers swing axes through piles of burnt wood in a forest.,Workers; Logging,Rogue River National Forest (forest),42.06236385,-123.9387952,"<a href=""https://cdm16085.contentdm.oclc.org/digital/collection/p15013coll4/id/453"" target=""_blank"">Rogue River National Forest Historic Images - Southern Oregon Digital Archives</a>",Image; Still Image,"<a href=""https://rightsstatements.org/page/NoC-US/1.0/"" target=""_blank"">No Copyright - United States</a>","<a href=""https://creativecommons.org/publicdomain/mark/1.0/"" target=""_blank"">Public Domain Mark 1.0</a>","Please provide the following credit required by the Memorandum of Understanding between Hannon Library and the Rogue River-Siskiyou National Forest: “This photograph is part of the Historical Records Collection of the Rogue River National Forest, and made available courtesy of Southern Oregon University Hannon Library.” See also: <a href=""http://soda.sou.edu/copyright.html""target=""_blank"">http://soda.sou.edu/copyright.html</a>","""Piling and burning slash,"" Rogue River-Siskiyou National Forest Agency. 1930, Southern Oregon University, Oregon. Southern Oregon Digital Archives, Rogue River National Forest Historic Images, <a href='https://cdm16085.contentdm.oclc.org/digital/collection/p15013coll4/id/453'target='_blank'>https://cdm16085.contentdm.oclc.org/digital/collection/p15013coll4/id/453</a>","<a href=""https://web.archive.org/web/20230522211809/https://cdm16085.contentdm.oclc.org/digital/collection/p15013coll4/id/453"" target=""_blank"">Archived Page</a>"